;id;acronym;status;title;startDate;endDate;totalCost;ecMaxContribution;legalBasis;topics;ecSignatureDate;frameworkProgramme;masterCall;subCall;fundingScheme;nature;objective;contentUpdateDate;rcn;preprocessed
32;101010042;CASSIO;SIGNED;CASSIO - Hybrid Electric Modular General Aviation Aircraft;01.12.20;30.11.22;3054035.0;2137824.5;H2020-EU.3.;H2020-EIC-SMEInst-2020-4;06.11.20;H2020;H2020-EIC-SMEInst-2018-2020;H2020-EIC-SMEInst-2018-2020-4;SME-2b;;General aviation is on the cusp of a transformation. The arrival of hybrid electric aircraft will unleash a revolution, driven by pent-up demand for fast and convenient regional travel. Electric air will enable much faster door-to-door travel than highways or high-speed rail. And it will do this at lower cost, without need for the massive, inflexible ground infrastructure. The benefit for the environment will be equally dramatic.Voltaero SAS is a French start-up that has developed the first in the world parallel and series distributed hybrid propulsion system that will power a family of general aviation aircraft, CASSIO, with the seating capacity of four to 10 passengers. Benefitting from more than 50 years of pioneering expertise of its founders, Voltaero is taking electric aircraft to an entirely new level. A flight demonstrator have validated the CASSIO configurations in-flight and on the ground, de-risking them for airworthiness certification and the subsequent application on new-production airplanes to be built using strong, lightweight materials.CASSIO propulsion system delivers a total output of 600 kW, allowing for the flight range of up to 1,200 km in a heavy-hybrid mode, offering 3,5 hours of flight autonomy. Since most of the short-haul routes in Europe lie within the distance of 100 to 1000 km, CASSIO will become a new mode of transport that will enable access to more communities in less time, enhance regional mobility, alleviate road congestion problems, - doing it all in a safe, a customer- and environmentally-friendly way.Based on the range required by the customer and the flight profile the CASSIO aircraft will be configured for production in three modular concepts:•CASSIO 330  - four-seater aircraft (range up to 200 km)•CASSIO 480 - six-seater (range of 200 – 600 km)•CASSIO 600 -  ten-seater (range of over 600 km)Fuel economy and CO2 reduction will vary from 20% in heavy hybrid mode, to 50% in mid hybrid, and to 100% in pure electric.;11.10.21 20:18;233002;['general', 'aviation', 'cusp', 'transformation', 'arrival', 'hybrid', 'electric', 'aircraft', 'unleash', 'revolution', 'driven', 'pentup', 'demand', 'fast', 'convenient', 'regional', 'travel', 'electric', 'air', 'enable', 'much', 'faster', 'doortodoor', 'travel', 'highway', 'highspeed', 'rail', 'lower', 'cost', 'without', 'need', 'massive', 'inflexible', 'ground', 'infrastructure', 'benefit', 'environment', 'equally', 'dramaticvoltaero', 'sa', 'french', 'startup', 'developed', 'first', 'world', 'parallel', 'series', 'distributed', 'hybrid', 'propulsion', 'system', 'power', 'family', 'general', 'aviation', 'aircraft', 'cassio', 'seating', 'capacity', 'four', '10', 'passenger', 'benefitting', '50', 'year', 'pioneering', 'expertise', 'founder', 'voltaero', 'taking', 'electric', 'aircraft', 'entirely', 'new', 'level', 'flight', 'demonstrator', 'validated', 'cassio', 'configuration', 'inflight', 'ground', 'derisking', 'airworthiness', 'certification', 'subsequent', 'application', 'newproduction', 'airplane', 'built', 'using', 'strong', 'lightweight', 'materialscassio', 'propulsion', 'system', 'delivers', 'total', 'output', '600', 'kw', 'allowing', 'flight', 'range', '1200', 'km', 'heavyhybrid', 'mode', 'offering', '35', 'hour', 'flight', 'autonomy', 'since', 'shorthaul', 'route', 'europe', 'lie', 'within', 'distance', '100', '1000', 'km', 'cassio', 'become', 'new', 'mode', 'transport', 'enable', 'access', 'community', 'le', 'time', 'enhance', 'regional', 'mobility', 'alleviate', 'road', 'congestion', 'problem', 'safe', 'customer', 'environmentallyfriendly', 'waybased', 'range', 'required', 'customer', 'flight', 'profile', 'cassio', 'aircraft', 'configured', 'production', 'three', 'modular', 'concepts•cassio', '330', 'fourseater', 'aircraft', 'range', '200', 'km•cassio', '480', 'sixseater', 'range', '200', '–', '600', 'km•cassio', '600', 'tenseater', 'range', '600', 'kmfuel', 'economy', 'co2', 'reduction', 'vary', '20', 'heavy', 'hybrid', 'mode', '50', 'mid', 'hybrid', '100', 'pure', 'electric']
33;101009187;VATOREX;SIGNED;ECO-FRIENDLY AND BREAKTHROUGH MITE TREATMENT FOR HONEY BEES;01.10.20;30.09.22;2347107.5;1642975.25;;H2020-EIC-SMEInst-2020-4;;H2020;;H2020-EIC-SMEInst-2018-2020-4;SME-2b;;Currently, honeybee mortality rates range from 5% to almost 30% depending on the country and the year, being some of the main causes the Varroa mite. This parasite is currently treated with chemicals, which are considered a necessary evil by a population of beekeepers that considers chemical treatments largely as a threat because themselves are a cause for the bees’ population decline. In view of these problems, other alternatives have been researched for decades, being the hyperthermia the methodology with highest potential to displace the use of chemicals. However, until now the current commercial solutions based on hyperthermia principles are not an alternative to chemical products due to a lower efficiency.Vatorex AG is an award winning Swiss company committed toproviding cost-efficient and eco-friendly solutions for beekeepers. The new business started in 2016 and provides beekeepers with an eco-friendly solution to protect their hives from their greatest enemy: the Varroa mite.We have developed an eco-friendly solution to kill the Varroa mites by using a natural principle of different heat tolerances of bees and varroa. In a range between 39°C - 42°C the parasite dies while the bees survive unharmed. In contrast to other hyperthermia systems, Vatorex Varroa Solution heats the brood combs directly from the inside thanks to a heating coil that acts like a floor-heating. Vatorex Varroa Solution has proven to be an effective treatment directly in the beehive (95% of male mites and nymphs die at 41ºC within 2 hours of treatment). The Vatorex-System means a reduction of sanitary cost of 66% per hive and a 18% in total cost of honey production that entails a total saving impact for the approximately 600,000 European beekeepers and their 17 million of hives. Vatorex is fully aligned with the European policy initiatives in biodiversity and pollinator protection such as European long-term survival strategy or the objectives of the EU Habitat directive.;09.04.21 14:38;231310;['currently', 'honeybee', 'mortality', 'rate', 'range', '5', 'almost', '30', 'depending', 'country', 'year', 'main', 'cause', 'varroa', 'mite', 'parasite', 'currently', 'treated', 'chemical', 'considered', 'necessary', 'evil', 'population', 'beekeeper', 'considers', 'chemical', 'treatment', 'largely', 'threat', 'cause', 'bees’', 'population', 'decline', 'view', 'problem', 'alternative', 'researched', 'decade', 'hyperthermia', 'methodology', 'highest', 'potential', 'displace', 'use', 'chemical', 'however', 'current', 'commercial', 'solution', 'based', 'hyperthermia', 'principle', 'alternative', 'chemical', 'product', 'due', 'lower', 'efficiencyvatorex', 'ag', 'award', 'winning', 'swiss', 'company', 'committed', 'toproviding', 'costefficient', 'ecofriendly', 'solution', 'beekeeper', 'new', 'business', 'started', '2016', 'provides', 'beekeeper', 'ecofriendly', 'solution', 'protect', 'hive', 'greatest', 'enemy', 'varroa', 'mitewe', 'developed', 'ecofriendly', 'solution', 'kill', 'varroa', 'mite', 'using', 'natural', 'principle', 'different', 'heat', 'tolerance', 'bee', 'varroa', 'range', '39°c', '42°c', 'parasite', 'dy', 'bee', 'survive', 'unharmed', 'contrast', 'hyperthermia', 'system', 'vatorex', 'varroa', 'solution', 'heat', 'brood', 'comb', 'directly', 'inside', 'thanks', 'heating', 'coil', 'act', 'like', 'floorheating', 'vatorex', 'varroa', 'solution', 'proven', 'effective', 'treatment', 'directly', 'beehive', '95', 'male', 'mite', 'nymph', 'die', '41ºc', 'within', '2', 'hour', 'treatment', 'vatorexsystem', 'mean', 'reduction', 'sanitary', 'cost', '66', 'per', 'hive', '18', 'total', 'cost', 'honey', 'production', 'entail', 'total', 'saving', 'impact', 'approximately', '600000', 'european', 'beekeeper', '17', 'million', 'hive', 'vatorex', 'fully', 'aligned', 'european', 'policy', 'initiative', 'biodiversity', 'pollinator', 'protection', 'european', 'longterm', 'survival', 'strategy', 'objective', 'eu', 'habitat', 'directive']
34;101010566;Fibrestop;SIGNED;Novel in-build filters for washing machines to stop microfibres pollution;01.11.20;31.10.22;2267500.0;1587250.0;;H2020-EIC-SMEInst-2020-4;;H2020;;H2020-EIC-SMEInst-2018-2020-4;SME-2b;;Microplastics are small (< 5mm) plastic particles which constitute a large part of plastic pollution. Although less visible to the eye, microplastics have been found to be dispersed in all environmental compartments and have a great ability to enter, influence and endanger natural food webs. The Environmental Investigation Agency estimated that a total of 51 trillion microplastic particles have accumulated in the ocean, with up to 219,000 tonnes of microplastics entering the sea from Europe each year. Microplastic pollution caused by washing processes of synthetic textiles has recently been assessed as the main source of primary microplastics in the oceans. Standard washing machines do not include a microfiber filter and an effective solution to reduce fibre emissions is not available on the market. PlanetCare has developed Fibrestop, the first built-in microfiber filter for washing machines. The device consists of a durable housing, a replaceable cartridge and an internal filter. Filtering is based on physical capture of fibres and no chemicals are used at any stage of the process. The cartridges can be returned to PlanetCare for recycling, ensuring a completely closed loop system and a circular business model. Having a retention rate verified by third parties testing, Fibrestop has to possibility to nullify the microplastic pollution derived from washes, generating tangible benefits for the environment and the people.The EIC funding will enable PlanetCare to optimize the Fibrestop and to perform all the validation activities necessary to obtain CE Mark and start commercialization in Europe.;14.04.21 20:54;231656;['microplastics', 'small', '5mm', 'plastic', 'particle', 'constitute', 'large', 'part', 'plastic', 'pollution', 'although', 'le', 'visible', 'eye', 'microplastics', 'found', 'dispersed', 'environmental', 'compartment', 'great', 'ability', 'enter', 'influence', 'endanger', 'natural', 'food', 'web', 'environmental', 'investigation', 'agency', 'estimated', 'total', '51', 'trillion', 'microplastic', 'particle', 'accumulated', 'ocean', '219000', 'tonne', 'microplastics', 'entering', 'sea', 'europe', 'year', 'microplastic', 'pollution', 'caused', 'washing', 'process', 'synthetic', 'textile', 'recently', 'assessed', 'main', 'source', 'primary', 'microplastics', 'ocean', 'standard', 'washing', 'machine', 'include', 'microfiber', 'filter', 'effective', 'solution', 'reduce', 'fibre', 'emission', 'available', 'market', 'planetcare', 'developed', 'fibrestop', 'first', 'builtin', 'microfiber', 'filter', 'washing', 'machine', 'device', 'consists', 'durable', 'housing', 'replaceable', 'cartridge', 'internal', 'filter', 'filtering', 'based', 'physical', 'capture', 'fibre', 'chemical', 'used', 'stage', 'process', 'cartridge', 'returned', 'planetcare', 'recycling', 'ensuring', 'completely', 'closed', 'loop', 'system', 'circular', 'business', 'model', 'retention', 'rate', 'verified', 'third', 'party', 'testing', 'fibrestop', 'possibility', 'nullify', 'microplastic', 'pollution', 'derived', 'wash', 'generating', 'tangible', 'benefit', 'environment', 'peoplethe', 'eic', 'funding', 'enable', 'planetcare', 'optimize', 'fibrestop', 'perform', 'validation', 'activity', 'necessary', 'obtain', 'ce', 'mark', 'start', 'commercialization', 'europe']
35;101008984;WasteShark;SIGNED;The mission of RanMarine Technology is the design, development and deployment of industrial autonomous surface vessels (ASV’s, drones) to capture as much waste as possible.;01.10.20;30.09.22;2269850.0;1588895.0;;H2020-EIC-SMEInst-2020-4;;H2020;;H2020-EIC-SMEInst-2018-2020-4;SME-2b;;"""Our innovation is a low-cost high-tech product that cleans urban/ harbour/delta waters: the WasteSharkTM-system. It is the world’s first autonomous drone-system designed to remove unwanted material. It consists of two components: - WasteSharks: a (swarm of) drone(s) - SharkPod: a launch/remove/waste unloading docking station/installationOur vision is to put a WasteShark-system in a specific waste-rich area (close to trash chokeholds that are found consistently) where a holistically networked swarm of WasteSharks finds and collects the waste and then delivers its """"catch"""" to the SharkPod. When deployed, the WasteSharks match learned and known conditions and head directly to where the largest concentration of debris is, given the information gathered on prior missions.  The swarm capability will increase efficiency of our drones, by 50% for a small swarm and 120% for the swarm of 10 drones. This allows existing and potential customers to become more efficient in collecting waste, whether plastics and other non-biodegradables (solid waste), oils and chemicals (liquid waste), pest plants (harmful biomass) or a combination of those.Used widely in the markets we will be focusing on, the WasteShark results in a 12 - 32% worldwide decrease of plastic debris (estimated between 4.8 to 12.7 million metric tons) that reaches open waters and causes not recoverable damage to our oceans.""";09.04.21 14:37;231308;['our', 'innovation', 'lowcost', 'hightech', 'product', 'clean', 'urban', 'harbourdelta', 'water', 'wastesharktmsystem', 'world’s', 'first', 'autonomous', 'dronesystem', 'designed', 'remove', 'unwanted', 'material', 'consists', 'two', 'component', 'wastesharks', 'swarm', 'of', 'drone', 'sharkpod', 'launchremovewaste', 'unloading', 'docking', 'stationinstallationour', 'vision', 'put', 'wastesharksystem', 'specific', 'wasterich', 'area', 'close', 'trash', 'chokehold', 'found', 'consistently', 'holistically', 'networked', 'swarm', 'wastesharks', 'find', 'collect', 'waste', 'delivers', 'catch', 'sharkpod', 'deployed', 'wastesharks', 'match', 'learned', 'known', 'condition', 'head', 'directly', 'largest', 'concentration', 'debris', 'is', 'given', 'information', 'gathered', 'prior', 'mission', 'swarm', 'capability', 'increase', 'efficiency', 'drone', '50', 'small', 'swarm', '120', 'swarm', '10', 'drone', 'allows', 'existing', 'potential', 'customer', 'become', 'efficient', 'collecting', 'waste', 'whether', 'plastic', 'nonbiodegradables', 'solid', 'waste', 'oil', 'chemical', 'liquid', 'waste', 'pest', 'plant', 'harmful', 'biomass', 'combination', 'thoseused', 'widely', 'market', 'focusing', 'on', 'wasteshark', 'result', '12', '32', 'worldwide', 'decrease', 'plastic', 'debris', 'estimated', '48', '127', 'million', 'metric', 'ton', 'reach', 'open', 'water', 'cause', 'recoverable', 'damage', 'ocean']
36;101009316;CREATE;SIGNED;Creating Artificial Turf (AT) Yarns with New Recycling Technologies for Circular Economy;01.10.20;30.09.22;3570000.0;2499000.0;;H2020-EIC-SMEInst-2020-4;;H2020;;H2020-EIC-SMEInst-2018-2020-4;SME-2b;;Re-Match was founded with the ambition of setting the new global standard in recycling artificial turf (AT), while protecting the environment. We aim to develop a sustainable, transparent, proven solution, promoting a full circular economy based on the upcycling of every AT component. To achieve a complete, cycle of used ATs, Re-Match has developed a ground-breaking patented process combining state-of-the-art technologies, adding the missing link to complete the upcycling of the plastic component. Re-Match is already capable of separating used ATs into sand, rubber and plastic (the first two efficiently recycled). Now, by dissolving the high-quality clean plastic material into a new resin, we will generate new turf yarns of similar quality to the originals, to be applied into new ATs, significantly reducing the waste derived from ATs and decreasing their environmental footprint. The process offers a cradle-to-cradle solution and a fully circular economy model for every AT component. Over 5 years, our resin has the potential to cumulatively save 450,000 tons of CO2e due to recyling of plastic fibres which have traditionally been difficult to be disposed off. As the AT demand and disposal has steadily increased following an annual growth of 16.6% between 2015 and 2017, and the sports segment is the most sought after, Re-Match aims to capture the new trends related to green and sustainable processes. As the team has grown, we have strengthened the process development and initiated the setup manufacturing capabilities, achieving important technological and commercial milestones. This project, aligned with our company strategy, will in a 5-year term allow the expansion of the full business, accumulating profits of €20M and creation of additional 22 FTEs exclusively from the EIC Accelerator project. In the long term, Re-Match will target the delivery of the plastic components also to other applications, establishing a new standard for plastic use and end-purpose.;14.04.21 20:38;231845;['rematch', 'founded', 'ambition', 'setting', 'new', 'global', 'standard', 'recycling', 'artificial', 'turf', 'at', 'protecting', 'environment', 'aim', 'develop', 'sustainable', 'transparent', 'proven', 'solution', 'promoting', 'full', 'circular', 'economy', 'based', 'upcycling', 'every', 'component', 'achieve', 'complete', 'cycle', 'used', 'at', 'rematch', 'developed', 'groundbreaking', 'patented', 'process', 'combining', 'stateoftheart', 'technology', 'adding', 'missing', 'link', 'complete', 'upcycling', 'plastic', 'component', 'rematch', 'already', 'capable', 'separating', 'used', 'at', 'sand', 'rubber', 'plastic', 'the', 'first', 'two', 'efficiently', 'recycled', 'now', 'dissolving', 'highquality', 'clean', 'plastic', 'material', 'new', 'resin', 'generate', 'new', 'turf', 'yarn', 'similar', 'quality', 'original', 'applied', 'new', 'at', 'significantly', 'reducing', 'waste', 'derived', 'at', 'decreasing', 'environmental', 'footprint', 'process', 'offer', 'cradletocradle', 'solution', 'fully', 'circular', 'economy', 'model', 'every', 'component', '5', 'year', 'resin', 'potential', 'cumulatively', 'save', '450000', 'ton', 'co2e', 'due', 'recyling', 'plastic', 'fibre', 'traditionally', 'difficult', 'disposed', 'off', 'demand', 'disposal', 'steadily', 'increased', 'following', 'annual', 'growth', '166', '2015', '2017', 'sport', 'segment', 'sought', 'after', 'rematch', 'aim', 'capture', 'new', 'trend', 'related', 'green', 'sustainable', 'process', 'team', 'grown', 'strengthened', 'process', 'development', 'initiated', 'setup', 'manufacturing', 'capability', 'achieving', 'important', 'technological', 'commercial', 'milestone', 'project', 'aligned', 'company', 'strategy', '5year', 'term', 'allow', 'expansion', 'full', 'business', 'accumulating', 'profit', '€20m', 'creation', 'additional', '22', 'ftes', 'exclusively', 'eic', 'accelerator', 'project', 'long', 'term', 'rematch', 'target', 'delivery', 'plastic', 'component', 'also', 'application', 'establishing', 'new', 'standard', 'plastic', 'use', 'endpurpose']
37;960251;MiWEndo;SIGNED;REVOLUTIONARY ELECTROMAGNETIC ENDOSCOPY ACCESSORY TO AUTOMATIZE POLYP DETECTION;01.10.20;30.09.22;2077043.75;1453930.63;;EIC-SMEInst-2018-2020;;H2020;;H2020-EIC-SMEInst-2018-2020-3;SME-2b;;Every year 1,4 million new cases of colorectal cancer (CRC) are diagnosed. Polyps and early-stage CRCs are usually asymptomatic or have symptoms that can be easily confused with other mild ailments. This cancer can be cured in more than 90% of cases if precancerous polyps are detected and removed. Colonoscopy is the most effective method to remove polyps in the entire colon. However, 8% of CRCs are diagnosed after a negative colonoscopy, and 22% of polyps are not detected due to visual limitations of the colonoscope camera. MiWEndo Solutions is a medical device startup focused on bringing innovative technologies to practical diagnosis of diseases related with tumor processes. Its first product is MiWEndo, a low cost and safe electromagnetic device designed to be attached to the tip of a conventional colonoscope. MiWEndo automatizes polyp detection emitting an alarm when a polyp is sensed, increases the field of view to 360º and provides quantitative differentiation between malignant and benign polyps without changing current clinical practice. Its core technology is based on microware imaging, and we have developed algorithms that can differentiate between healthy colon mucosa, cancer, and different histological types of polyps based on their dielectric properties. Our technology is protected with European patent EP3195786A1. After CRC detection, additional applications of our technology will include other bowel disorders. We have a financial need of 3,8 M€ between 2020 and 2023 (product launch). Of these, 1,5 M€ will be provided as a grant from the European Commission within the EIC Accelerator Program (2020-2022), corresponding to 70% of the project budget. At the end of the project MiWEndo will have reached TRL8, including a clinical validation in a clinical trial, and will have obtained CE mark and FDA approval prior to product launch in early markets.;14.04.21 21:13;231287;['every', 'year', '14', 'million', 'new', 'case', 'colorectal', 'cancer', 'crc', 'diagnosed', 'polyp', 'earlystage', 'crcs', 'usually', 'asymptomatic', 'symptom', 'easily', 'confused', 'mild', 'ailment', 'cancer', 'cured', '90', 'case', 'precancerous', 'polyp', 'detected', 'removed', 'colonoscopy', 'effective', 'method', 'remove', 'polyp', 'entire', 'colon', 'however', '8', 'crcs', 'diagnosed', 'negative', 'colonoscopy', '22', 'polyp', 'detected', 'due', 'visual', 'limitation', 'colonoscope', 'camera', 'miwendo', 'solution', 'medical', 'device', 'startup', 'focused', 'bringing', 'innovative', 'technology', 'practical', 'diagnosis', 'disease', 'related', 'tumor', 'process', 'first', 'product', 'miwendo', 'low', 'cost', 'safe', 'electromagnetic', 'device', 'designed', 'attached', 'tip', 'conventional', 'colonoscope', 'miwendo', 'automatizes', 'polyp', 'detection', 'emitting', 'alarm', 'polyp', 'sensed', 'increase', 'field', 'view', '360º', 'provides', 'quantitative', 'differentiation', 'malignant', 'benign', 'polyp', 'without', 'changing', 'current', 'clinical', 'practice', 'core', 'technology', 'based', 'microware', 'imaging', 'developed', 'algorithm', 'differentiate', 'healthy', 'colon', 'mucosa', 'cancer', 'different', 'histological', 'type', 'polyp', 'based', 'dielectric', 'property', 'technology', 'protected', 'european', 'patent', 'ep3195786a1', 'crc', 'detection', 'additional', 'application', 'technology', 'include', 'bowel', 'disorder', 'financial', 'need', '38', 'm€', '2020', '2023', 'product', 'launch', 'these', '15', 'm€', 'provided', 'grant', 'european', 'commission', 'within', 'eic', 'accelerator', 'program', '20202022', 'corresponding', '70', 'project', 'budget', 'end', 'project', 'miwendo', 'reached', 'trl8', 'including', 'clinical', 'validation', 'clinical', 'trial', 'obtained', 'ce', 'mark', 'fda', 'approval', 'prior', 'product', 'launch', 'early', 'market']
