;id;acronym;status;title;startDate;endDate;totalCost;ecMaxContribution;legalBasis;topics;ecSignatureDate;frameworkProgramme;masterCall;subCall;fundingScheme;nature;objective;contentUpdateDate;rcn;preprocessed
101;893282;MM-CAHF;SIGNED;Combinatorial aspects of Heegaard Floer homology for knots and links;01.09.21;31.08.23;139850.88;139850.88;;MSCA-IF-2019;;H2020;;H2020-MSCA-IF-2019;MSCA-IF-EF-RI;;The action's goal is to achieve major advances in Heegaard Floer homology for knots and links. Heegaard Floer homology is a package of powerful invariants for 3-manifolds, and knots and links inside them. Introduced two decades ago, it is now a major research area in low-dimensional topology. To a knot or link in the 3-sphere, together with extra data called `decoration', Heegaard Floer homology associates a bigraded vector space which determines key topological properties of such a knot or link, such as its Alexander polynomial and its Seifert genus. Moreover, given a (decorated) link cobordism between two links, there is a linear map induced between their Heegaard Floer homology. The original definition of Heegaard Floer homology is based on counting pseudo-holomorphic curves in symplectic manifolds, but there exist combinatorial reformulations of the vector spaces associated to decorated knots and links.The proposal consists of three major projects:1) Give a combinatorial reformulation of the Heegaard Floer cobordism maps, to make their computation algorithmic, by extending existing combinatorial definitions of the vector spaces associated to decorated knots and links.2) Extend the most efficient combinatorial reformulation, namely the Kauffman-states functor, from decorated knots to decorated links.3) Define a combinatorial Heegaard Floer invariant for partially decorated links, for which attempts to give an analytic definition seems unfeasible.;20.04.21 00:37;228036;['action', 'goal', 'achieve', 'major', 'advance', 'heegaard', 'floer', 'homology', 'knot', 'link', 'heegaard', 'floer', 'homology', 'package', 'powerful', 'invariant', '3manifolds', 'knot', 'link', 'inside', 'them', 'introduced', 'two', 'decade', 'ago', 'major', 'research', 'area', 'lowdimensional', 'topology', 'knot', 'link', '3sphere', 'together', 'extra', 'data', 'called', 'decoration', 'heegaard', 'floer', 'homology', 'associate', 'bigraded', 'vector', 'space', 'determines', 'key', 'topological', 'property', 'knot', 'link', 'alexander', 'polynomial', 'seifert', 'genus', 'moreover', 'given', 'decorated', 'link', 'cobordism', 'two', 'link', 'linear', 'map', 'induced', 'heegaard', 'floer', 'homology', 'original', 'definition', 'heegaard', 'floer', 'homology', 'based', 'counting', 'pseudoholomorphic', 'curve', 'symplectic', 'manifold', 'exist', 'combinatorial', 'reformulations', 'vector', 'space', 'associated', 'decorated', 'knot', 'linksthe', 'proposal', 'consists', 'three', 'major', 'projects1', 'give', 'combinatorial', 'reformulation', 'heegaard', 'floer', 'cobordism', 'map', 'make', 'computation', 'algorithmic', 'extending', 'existing', 'combinatorial', 'definition', 'vector', 'space', 'associated', 'decorated', 'knot', 'links2', 'extend', 'efficient', 'combinatorial', 'reformulation', 'namely', 'kauffmanstates', 'functor', 'decorated', 'knot', 'decorated', 'links3', 'define', 'combinatorial', 'heegaard', 'floer', 'invariant', 'partially', 'decorated', 'link', 'attempt', 'give', 'analytic', 'definition', 'seems', 'unfeasible']
102;880349;ADVOS;SIGNED;ADVanced Organ Support – Revolution in intensive care for treatment of multiple organ failure;01.12.19;30.04.22;3275055.0;2292538.5;;EIC-SMEInst-2018-2020;;H2020;;H2020-SMEInst-2018-2020-2;SME-2;;60% of intensive care patients die of multiple organ failure (MOF), resulting in a market potential in Western EU of €1.19bn in 13 targeted countries and in the US of €2.05bn. The detoxification organs are nearly always involved in MOF. Therefore, to treat MOF successfully, the vicious cycle of progressing organ failures and increasing toxin accumulation in the body has to be stopped. ADVOS has the potential to revolutionize the therapy of ICU patients worldwide, as it is the first and only ICU device for combined liver, lung, kidney and acid-base support in one device. ADVOS improves survival of patients with MOF from 10 to 50%. No serious side-effects have occurred so far in more than 500 treated patients. Currently, there is no other device in the market that supports all main detoxification organs as the ADVOS system does. As the ADVOS therapy is low-invasive, it can be used by far more intensive care units and can support by far more patients than other devices for e.g. removal of CO2.Although the ADVOS device has the CE mark and is already in the German market (20 first beta user hospitals) the TRL is 6, as we learned in the German market that due to the staff problem and the stressful environment in the ICU the ADVOS usability is by far not good enough to increase revenues more quickly. Therefore, the goal of the SME project ADVOS is faster market entry and penetration through improvement of device usability and ease of use (Integration of accessory components, state of the art turnable touch screen and smart user assistance), integration of IoT for remote access/maintenance in device, and increased marketing and communication measures (Total project cost: 3.3m€ / SME grant amount: 2.3m€).;03.06.21 15:16;226898;['60', 'intensive', 'care', 'patient', 'die', 'multiple', 'organ', 'failure', 'mof', 'resulting', 'market', 'potential', 'western', 'eu', '€119bn', '13', 'targeted', 'country', 'u', '€205bn', 'detoxification', 'organ', 'nearly', 'always', 'involved', 'mof', 'therefore', 'treat', 'mof', 'successfully', 'vicious', 'cycle', 'progressing', 'organ', 'failure', 'increasing', 'toxin', 'accumulation', 'body', 'stopped', 'advos', 'potential', 'revolutionize', 'therapy', 'icu', 'patient', 'worldwide', 'first', 'icu', 'device', 'combined', 'liver', 'lung', 'kidney', 'acidbase', 'support', 'one', 'device', 'advos', 'improves', 'survival', 'patient', 'mof', '10', '50', 'serious', 'sideeffects', 'occurred', 'far', '500', 'treated', 'patient', 'currently', 'device', 'market', 'support', 'main', 'detoxification', 'organ', 'advos', 'system', 'doe', 'advos', 'therapy', 'lowinvasive', 'used', 'far', 'intensive', 'care', 'unit', 'support', 'far', 'patient', 'device', 'eg', 'removal', 'co2although', 'advos', 'device', 'ce', 'mark', 'already', 'german', 'market', '20', 'first', 'beta', 'user', 'hospital', 'trl', '6', 'learned', 'german', 'market', 'due', 'staff', 'problem', 'stressful', 'environment', 'icu', 'advos', 'usability', 'far', 'good', 'enough', 'increase', 'revenue', 'quickly', 'therefore', 'goal', 'sme', 'project', 'advos', 'faster', 'market', 'entry', 'penetration', 'improvement', 'device', 'usability', 'ease', 'use', 'integration', 'accessory', 'component', 'state', 'art', 'turnable', 'touch', 'screen', 'smart', 'user', 'assistance', 'integration', 'iot', 'remote', 'accessmaintenance', 'device', 'increased', 'marketing', 'communication', 'measure', 'total', 'project', 'cost', '33m€', 'sme', 'grant', 'amount', '23m€']
103;887881;Hastlayer;CLOSED;Hastlayer - turning software into hardware for faster computing;01.01.20;30.06.20;71429.0;50000.0;;EIC-SMEInst-2018-2020;;H2020;;H2020-SMEInst-2018-2020-1;SME-1;;High-level synthesis (HLS) is increasingly popular for the design of high-performance and energy-efficient heterogeneous systems, shortening time-to-market and addressing today’s system complexity. HLS allows designers to work at a higher-level of abstraction by using a software program to specify the hardware functionality. Additionally, HLS is particularly interesting for designing field-programmable gate array circuits (FPGA), where hardware implementations can be easily refined and replaced in the target device. Recent years have seen much activity in the HLS research community, with a plethora of HLS tool offerings, from both industry and academia, but none of these solutions are widespread for industrial use.FPGA Programming requires certain skills, specific knowledge and specialised hardware. Gathering these are expensive and due to this limitation can only be achieved by a small fraction of software developers, which makes access to FPGA equally limited. With our solution we aim to give access to those software engineers who lack this specific knowledge.Hastlayer a provides an HLS service consisting of multiple tools that allows desktop, web and mobile software developers to increase the performance of their computationally intensive and resource demanding applications by executing critical parts of their software on a specialised hardware architecture remotely or locally (FPGA) without having the in-depth knowledge of such platforms. This solution results in lower development cost when it comes to optimisation, cheaper hardware when it comes to speeding up a slow program but most importantly makes continuous development exceptionally fast. Before we can turn Hastlayer into a product we need to carry out a feasibility study in order to define use cases tackle security issues and develop the most suitable business mode to maximize market penetration.;15.09.20 18:35;226382;['highlevel', 'synthesis', 'hl', 'increasingly', 'popular', 'design', 'highperformance', 'energyefficient', 'heterogeneous', 'system', 'shortening', 'timetomarket', 'addressing', 'today’s', 'system', 'complexity', 'hl', 'allows', 'designer', 'work', 'higherlevel', 'abstraction', 'using', 'software', 'program', 'specify', 'hardware', 'functionality', 'additionally', 'hl', 'particularly', 'interesting', 'designing', 'fieldprogrammable', 'gate', 'array', 'circuit', 'fpga', 'hardware', 'implementation', 'easily', 'refined', 'replaced', 'target', 'device', 'recent', 'year', 'seen', 'much', 'activity', 'hl', 'research', 'community', 'plethora', 'hl', 'tool', 'offering', 'industry', 'academia', 'none', 'solution', 'widespread', 'industrial', 'usefpga', 'programming', 'requires', 'certain', 'skill', 'specific', 'knowledge', 'specialised', 'hardware', 'gathering', 'expensive', 'due', 'limitation', 'achieved', 'small', 'fraction', 'software', 'developer', 'make', 'access', 'fpga', 'equally', 'limited', 'solution', 'aim', 'give', 'access', 'software', 'engineer', 'lack', 'specific', 'knowledgehastlayer', 'provides', 'hl', 'service', 'consisting', 'multiple', 'tool', 'allows', 'desktop', 'web', 'mobile', 'software', 'developer', 'increase', 'performance', 'computationally', 'intensive', 'resource', 'demanding', 'application', 'executing', 'critical', 'part', 'software', 'specialised', 'hardware', 'architecture', 'remotely', 'locally', 'fpga', 'without', 'indepth', 'knowledge', 'platform', 'solution', 'result', 'lower', 'development', 'cost', 'come', 'optimisation', 'cheaper', 'hardware', 'come', 'speeding', 'slow', 'program', 'importantly', 'make', 'continuous', 'development', 'exceptionally', 'fast', 'turn', 'hastlayer', 'product', 'need', 'carry', 'feasibility', 'study', 'order', 'define', 'use', 'case', 'tackle', 'security', 'issue', 'develop', 'suitable', 'business', 'mode', 'maximize', 'market', 'penetration']
104;889906;PICSOHF;CLOSED;PICSOHF, A minimally invasive cardiac intervention medical device to regenerate a damaged heart and extend the life of patients with Heart Failure;01.01.20;30.04.20;71429.0;50000.0;;EIC-SMEInst-2018-2020;;H2020;;H2020-SMEInst-2018-2020-1;SME-1;;Worldwide 26 million people live with HF (Heart Failure) which is a major burden, not only for the patient, but one that also threatens the sustainability of national healthcare systems. Despite advances in treatment solutions over the last 30 years, improvements have not met the expectations for cardiac recovery and prognosis following heart attack. Current treatments are only partial solutions as they cannot regenerate the damaged heart tissue, and are thus unable to stop the progressive loss of heart function, low short- and medium-term life expectancy, and impoverished quality of life due to co-morbidities and/or frequent and continuous re-hospitalisations. Regenerative concepts, such as cellular therapies to regain cardiac function, once of the greatest hope for heart failure patients, have been recently discredited as they have been unable to show scientific proof of efficacy. Miracor, developed and clinically tested PiCSO, a breakthrough cardiac intervention triggering myocardial regeneration. Our therapy consists of a percutaneous right heart catheter intervention using proprietary software for feedback control that temporarily elevates the pressure in cardiac veins reactivating innate regeneration pathways. We have tested PiCSO in chronic HF patients (8 patients versus 22 controls) and demonstrated that 30 minutes of intervention changed the pattern of regenerative biomarkers in cardiac veins that resulted in significantly improved survival at 10 years follow up. Our patented technology (PiCSOHF ) is changing the market in HF, as no similar device is currently available. Our strategic goal is to become Europe´s leading reference in treating HF. After full technological, clinical and commercial development, PICSOHF profits will increase by +€66M within 5 years after commercial launch.;16.07.20 14:23;226639;['worldwide', '26', 'million', 'people', 'live', 'hf', 'heart', 'failure', 'major', 'burden', 'patient', 'one', 'also', 'threatens', 'sustainability', 'national', 'healthcare', 'system', 'despite', 'advance', 'treatment', 'solution', 'last', '30', 'year', 'improvement', 'met', 'expectation', 'cardiac', 'recovery', 'prognosis', 'following', 'heart', 'attack', 'current', 'treatment', 'partial', 'solution', 'cannot', 'regenerate', 'damaged', 'heart', 'tissue', 'thus', 'unable', 'stop', 'progressive', 'loss', 'heart', 'function', 'low', 'short', 'mediumterm', 'life', 'expectancy', 'impoverished', 'quality', 'life', 'due', 'comorbidities', 'andor', 'frequent', 'continuous', 'rehospitalisations', 'regenerative', 'concept', 'cellular', 'therapy', 'regain', 'cardiac', 'function', 'greatest', 'hope', 'heart', 'failure', 'patient', 'recently', 'discredited', 'unable', 'show', 'scientific', 'proof', 'efficacy', 'miracor', 'developed', 'clinically', 'tested', 'picso', 'breakthrough', 'cardiac', 'intervention', 'triggering', 'myocardial', 'regeneration', 'therapy', 'consists', 'percutaneous', 'right', 'heart', 'catheter', 'intervention', 'using', 'proprietary', 'software', 'feedback', 'control', 'temporarily', 'elevates', 'pressure', 'cardiac', 'vein', 'reactivating', 'innate', 'regeneration', 'pathway', 'tested', 'picso', 'chronic', 'hf', 'patient', '8', 'patient', 'versus', '22', 'control', 'demonstrated', '30', 'minute', 'intervention', 'changed', 'pattern', 'regenerative', 'biomarkers', 'cardiac', 'vein', 'resulted', 'significantly', 'improved', 'survival', '10', 'year', 'follow', 'up', 'patented', 'technology', 'picsohf', 'changing', 'market', 'hf', 'similar', 'device', 'currently', 'available', 'strategic', 'goal', 'become', 'europe´s', 'leading', 'reference', 'treating', 'hf', 'full', 'technological', 'clinical', 'commercial', 'development', 'picsohf', 'profit', 'increase', '€66m', 'within', '5', 'year', 'commercial', 'launch']
105;889059;OhmMAT-NANO;CLOSED;Next Generation Composite Material Heating;01.12.19;31.05.20;71429.0;50000.0;;EIC-SMEInst-2018-2020;;H2020;;H2020-SMEInst-2018-2020-1;SME-1;;Flexible heating systems are used in numerous applications such as the heating of Industrial sized liquid tanks, to de-icing chiller units. However, they are based on silicon with non-optimal thermal conductivity and resistive wire elements. The result is restricted flexibility and low efficiency. OHMVO was a company created to find a solution for the numerous clients frustrated with this solution.We have designed and are patenting a thermally improved and conductive silicon. Highly efficient and flexible, aside from external heating of irregular surfaces, for the first time our product will deliver embedded heating, heating from within a uniform, or complex shaped component.We request phase 1 funding to allow us to complete a prototype demonstration with a potential client and to investigate and select the first applications to target for market entry. With multiple clients already interested and the possibility to drive many new breakthrough applications we are predicting revenues of 16.45M and 32 employees by 2026.;01.09.20 18:29;226407;['flexible', 'heating', 'system', 'used', 'numerous', 'application', 'heating', 'industrial', 'sized', 'liquid', 'tank', 'deicing', 'chiller', 'unit', 'however', 'based', 'silicon', 'nonoptimal', 'thermal', 'conductivity', 'resistive', 'wire', 'element', 'result', 'restricted', 'flexibility', 'low', 'efficiency', 'ohmvo', 'company', 'created', 'find', 'solution', 'numerous', 'client', 'frustrated', 'solutionwe', 'designed', 'patenting', 'thermally', 'improved', 'conductive', 'silicon', 'highly', 'efficient', 'flexible', 'aside', 'external', 'heating', 'irregular', 'surface', 'first', 'time', 'product', 'deliver', 'embedded', 'heating', 'heating', 'within', 'uniform', 'complex', 'shaped', 'componentwe', 'request', 'phase', '1', 'funding', 'allow', 'u', 'complete', 'prototype', 'demonstration', 'potential', 'client', 'investigate', 'select', 'first', 'application', 'target', 'market', 'entry', 'multiple', 'client', 'already', 'interested', 'possibility', 'drive', 'many', 'new', 'breakthrough', 'application', 'predicting', 'revenue', '1645m', '32', 'employee', '2026']
106;887722;Colourganisms;CLOSED;Microbial production of custom-made, pure and sustainable anthocyanins;01.02.20;31.10.20;71429.0;50000.0;;EIC-SMEInst-2018-2020;;H2020;;H2020-SMEInst-2018-2020-1;SME-1;;The colour industry is undergoing a radical change as it moves from harmful, synthetic colorants to natural, plant-based colour compounds. This change creates several problems as natural colours are poor in quality, they are impure and they compete directly with agricultural land use and food. To overcome these limitations, at N-CHROMA we have developed a new revolutionary technology to produce colour compounds suitable for the Food & Beverage and Colour Cosmetics industries. We do this by using microorganisms to produce custom-made, high quality and pure anthocyanin compounds in a sustainable and cost effective manner. To achieve this we are using baker’s yeast as a microbial cell factory to produce stable anthocyanins. This class of colour compounds shows advanced characteristics in terms of stability to pH changes, making them more attractive to the target markets. With the SME instrument phase 1 grant, we aim to assess the functionality of our ingredients to existing products. Also, the cost-in-use of our highly pure compounds will be assessed during the technical feasibility study. In addition, we will perform commercial feasibility studies for the use of anthocyanins in the cosmetic, personal care and nutraceutical markets. Such markets have not been investigated so far but they hold great potential for anthocyanins due to their high antioxidant activity and biological function.;01.03.21 19:14;226379;['colour', 'industry', 'undergoing', 'radical', 'change', 'move', 'harmful', 'synthetic', 'colorants', 'natural', 'plantbased', 'colour', 'compound', 'change', 'creates', 'several', 'problem', 'natural', 'colour', 'poor', 'quality', 'impure', 'compete', 'directly', 'agricultural', 'land', 'use', 'food', 'overcome', 'limitation', 'nchroma', 'developed', 'new', 'revolutionary', 'technology', 'produce', 'colour', 'compound', 'suitable', 'food', 'beverage', 'colour', 'cosmetic', 'industry', 'using', 'microorganism', 'produce', 'custommade', 'high', 'quality', 'pure', 'anthocyanin', 'compound', 'sustainable', 'cost', 'effective', 'manner', 'achieve', 'using', 'baker’s', 'yeast', 'microbial', 'cell', 'factory', 'produce', 'stable', 'anthocyanins', 'class', 'colour', 'compound', 'show', 'advanced', 'characteristic', 'term', 'stability', 'ph', 'change', 'making', 'attractive', 'target', 'market', 'sme', 'instrument', 'phase', '1', 'grant', 'aim', 'ass', 'functionality', 'ingredient', 'existing', 'product', 'also', 'costinuse', 'highly', 'pure', 'compound', 'assessed', 'technical', 'feasibility', 'study', 'addition', 'perform', 'commercial', 'feasibility', 'study', 'use', 'anthocyanins', 'cosmetic', 'personal', 'care', 'nutraceutical', 'market', 'market', 'investigated', 'far', 'hold', 'great', 'potential', 'anthocyanins', 'due', 'high', 'antioxidant', 'activity', 'biological', 'function']
107;882295;BlueDot;CLOSED;A long-acting, constant release ocular implant for the sustained delivery of biologics and small molecules for the treatment of retinal diseases.;01.11.19;29.02.20;71429.0;50000.0;;EIC-SMEInst-2018-2020;;H2020;;H2020-SMEInst-2018-2020-1;SME-1;;Seventy-six million people will suffer from blindness by 2020. Age-related retinal disorders - macular degeneration (AMD) and diabetic macular edema (DME) are two of the leading causes of blindness in the world. About 200,000 new cases of advanced, age-related AMD identified each year in the United States and between 14.9 and 21.5 million cases of early AMD, and between 3.9 and 4.8 million cases of late AMD is expected in Europe by 2040. The complexity of eye anatomy presents challenges for treatment. Current treatment, intravitreal injections (IVI) are the highest growth medical procedure in the globe, with an estimated 20 million intravitreal injections globally in 2016. Ranibizumab, treatment blocking vascular endothelial growth factor (VEGF), which promotes blood vessel growth, costs approximately $2,000 in USA and €1000 per injection. Patients may need up to 12 injection per year. Additionally, this treatment significantly affects patient comfort.MicroSert has developed BlueDot – a novel, long-acting release (LAR) ocular implant for the sustained delivery of biologics and small molecules for the treatment of retinal diseases. BlueDot is implantable to the tear duct and releases therapeutic inside the eye. Implantation requires one-step office-based procedure using proprietary implantation device with safety monitoring system and with no incision needed. BlueDot is refillable and lasts up to two years.The SME-I Phase 1 project perfectly suits the innovation’s current stage of development and overall business strategy allowing MicroSert to check final specifications of BlueDot, establish a sound business development and gain partners necessary for the Phase II study.;13.06.20 14:39;226589;['seventysix', 'million', 'people', 'suffer', 'blindness', '2020', 'agerelated', 'retinal', 'disorder', 'macular', 'degeneration', 'amd', 'diabetic', 'macular', 'edema', 'dme', 'two', 'leading', 'cause', 'blindness', 'world', '200000', 'new', 'case', 'advanced', 'agerelated', 'amd', 'identified', 'year', 'united', 'state', '149', '215', 'million', 'case', 'early', 'amd', '39', '48', 'million', 'case', 'late', 'amd', 'expected', 'europe', '2040', 'complexity', 'eye', 'anatomy', 'present', 'challenge', 'treatment', 'current', 'treatment', 'intravitreal', 'injection', 'ivi', 'highest', 'growth', 'medical', 'procedure', 'globe', 'estimated', '20', 'million', 'intravitreal', 'injection', 'globally', '2016', 'ranibizumab', 'treatment', 'blocking', 'vascular', 'endothelial', 'growth', 'factor', 'vegf', 'promotes', 'blood', 'vessel', 'growth', 'cost', 'approximately', '2000', 'usa', '€1000', 'per', 'injection', 'patient', 'may', 'need', '12', 'injection', 'per', 'year', 'additionally', 'treatment', 'significantly', 'affect', 'patient', 'comfortmicrosert', 'developed', 'bluedot', '–', 'novel', 'longacting', 'release', 'lar', 'ocular', 'implant', 'sustained', 'delivery', 'biologics', 'small', 'molecule', 'treatment', 'retinal', 'disease', 'bluedot', 'implantable', 'tear', 'duct', 'release', 'therapeutic', 'inside', 'eye', 'implantation', 'requires', 'onestep', 'officebased', 'procedure', 'using', 'proprietary', 'implantation', 'device', 'safety', 'monitoring', 'system', 'incision', 'needed', 'bluedot', 'refillable', 'last', 'two', 'yearsthe', 'smei', 'phase', '1', 'project', 'perfectly', 'suit', 'innovation’s', 'current', 'stage', 'development', 'overall', 'business', 'strategy', 'allowing', 'microsert', 'check', 'final', 'specification', 'bluedot', 'establish', 'sound', 'business', 'development', 'gain', 'partner', 'necessary', 'phase', 'ii', 'study']
