;id;acronym;status;title;startDate;endDate;totalCost;ecMaxContribution;legalBasis;topics;ecSignatureDate;frameworkProgramme;masterCall;subCall;fundingScheme;nature;objective;contentUpdateDate;rcn;preprocessed
0;101034345;DOROTHY;SIGNED;DevelOp interdisciplinaRy apprOaches to healTH crises collaborativelY’;01.09.21;31.08.26;5517000.0;2758500.0;H2020-EU.1.3.;MSCA-COFUND-2020;27.04.21;H2020;H2020-MSCA-COFUND-2020;H2020-MSCA-COFUND-2020;MSCA-COFUND-FP;;Responding to the need to equip European societies with multi-disciplinary expertise to tackle future public health crises, DOROTHY COFUND will recruit, train and launch the careers of 25 excellent fellows through 36-month fellowships (18 months overseas and 18 months in Ireland). Postdoctoral researchers  from all disciplines will be eligible (e.g. epidemiology, engineering of materials, diagnostic tools, psychology, economics, social history, education, sociology, political science, medical and health humanities and philosophy), as long as their research projects fall within the remit of public-health crises.DOROTHY's goals are:-Support fellows’ career development, through excellent training and supervision and mentoring, and prepare them for future career opportunities by means of the exceptional  skills and timely and topical experience that will be gained through these fellowships. - Create  a critical mass of well-networked experts, from all disciplinary areas, who will be  fully able to engage with the Irish and EU innovation ecosystem, through the set-up of an innovative multidisciplinary research and training platform. These individuals will be trained to tackle future public-health crises in ways that will lead to positive societal impact.-Promote the dissemination and communication of impactful research beyond traditional academic channels, targeting policymakers and population at large , with the objective of contributing to resourceful and resilient societies. - Pioneer an innovative multidisciplinary approach to the way public health crises are understood and tackled.  As they are broad-ranging and complex phenomena, with multi-issue implications, solutions cannot prescind from the cooperation between disciplines, sectors and research areas. DOROTHY, which shows the feasibility of that, aims to become a replicable template for multidisciplinary, international and intersectoral training approaches.;02.09.21 20:45;235801;['responding', 'need', 'equip', 'european', 'society', 'multidisciplinary', 'expertise', 'tackle', 'future', 'public', 'health', 'crisis', 'dorothy', 'cofund', 'recruit', 'train', 'launch', 'career', '25', 'excellent', 'fellow', '36month', 'fellowship', '18', 'month', 'overseas', '18', 'month', 'ireland', 'postdoctoral', 'researcher', 'discipline', 'eligible', 'eg', 'epidemiology', 'engineering', 'material', 'diagnostic', 'tool', 'psychology', 'economics', 'social', 'history', 'education', 'sociology', 'political', 'science', 'medical', 'health', 'humanity', 'philosophy', 'long', 'research', 'project', 'fall', 'within', 'remit', 'publichealth', 'crisesdorothys', 'goal', 'aresupport', 'fellows’', 'career', 'development', 'excellent', 'training', 'supervision', 'mentoring', 'prepare', 'future', 'career', 'opportunity', 'mean', 'exceptional', 'skill', 'timely', 'topical', 'experience', 'gained', 'fellowship', 'create', 'critical', 'mass', 'wellnetworked', 'expert', 'disciplinary', 'area', 'fully', 'able', 'engage', 'irish', 'eu', 'innovation', 'ecosystem', 'setup', 'innovative', 'multidisciplinary', 'research', 'training', 'platform', 'individual', 'trained', 'tackle', 'future', 'publichealth', 'crisis', 'way', 'lead', 'positive', 'societal', 'impactpromote', 'dissemination', 'communication', 'impactful', 'research', 'beyond', 'traditional', 'academic', 'channel', 'targeting', 'policymakers', 'population', 'large', 'objective', 'contributing', 'resourceful', 'resilient', 'society', 'pioneer', 'innovative', 'multidisciplinary', 'approach', 'way', 'public', 'health', 'crisis', 'understood', 'tackled', 'broadranging', 'complex', 'phenomenon', 'multiissue', 'implication', 'solution', 'cannot', 'prescind', 'cooperation', 'discipline', 'sector', 'research', 'area', 'dorothy', 'show', 'feasibility', 'that', 'aim', 'become', 'replicable', 'template', 'multidisciplinary', 'international', 'intersectoral', 'training', 'approach']
1;101034926;CNergy;SIGNED;Carbon Nanomembranes for Energy Storage Applications;01.05.21;31.01.22;0.0;100000.0;;FETOPEN-03-2018-2019-2020;;H2020;;H2020-FETOPEN-2018-2019-2020-4;CSA-LSP;;CNM Technologies (CNMT) has developed a highly permeable and selective composite membrane with a nanometre-thin carbon nanomembrane (CNM) as active layer, which is – in the FET-open project ITS-THIN – introduced into demanding water separation applications. CNMT plans in a joint venture with the Dutch SME BLUE-Tec (also partner in ITS-THIN) to introduce these membranes into the water filtration market. Recently, scientists at Friedrich-Schiller University Jena (FSU) showed in the framework of the Graphene FET-flagship a high proton and lithium ion permeance of CNMs. Combining these findings with the ability to produce large-area CNM-composite membranes, a fully new technology is emerging: the use of ultrathin CNMs as separator membranes or proton exchange membranes (PEM) in battery and fuel cell applications. Thinner membranes promise a faster and more selective ion transport resulting in smaller, more powerful, and more reliable energy storage devices. This new window of opportunity will be explored in this feasibility study. In case of a positive outcome, CNergy will result in a business and action plan, how to introduce CNMs into batteries and fuel cells.;21.05.21 11:29;235780;['cnm', 'technology', 'cnmt', 'developed', 'highly', 'permeable', 'selective', 'composite', 'membrane', 'nanometrethin', 'carbon', 'nanomembrane', 'cnm', 'active', 'layer', '–', 'fetopen', 'project', 'itsthin', '–', 'introduced', 'demanding', 'water', 'separation', 'application', 'cnmt', 'plan', 'joint', 'venture', 'dutch', 'sme', 'bluetec', 'also', 'partner', 'itsthin', 'introduce', 'membrane', 'water', 'filtration', 'market', 'recently', 'scientist', 'friedrichschiller', 'university', 'jena', 'fsu', 'showed', 'framework', 'graphene', 'fetflagship', 'high', 'proton', 'lithium', 'ion', 'permeance', 'cnms', 'combining', 'finding', 'ability', 'produce', 'largearea', 'cnmcomposite', 'membrane', 'fully', 'new', 'technology', 'emerging', 'use', 'ultrathin', 'cnms', 'separator', 'membrane', 'proton', 'exchange', 'membrane', 'pem', 'battery', 'fuel', 'cell', 'application', 'thinner', 'membrane', 'promise', 'faster', 'selective', 'ion', 'transport', 'resulting', 'smaller', 'powerful', 'reliable', 'energy', 'storage', 'device', 'new', 'window', 'opportunity', 'explored', 'feasibility', 'study', 'case', 'positive', 'outcome', 'cnergy', 'result', 'business', 'action', 'plan', 'introduce', 'cnms', 'battery', 'fuel', 'cell']
2;957151;SATELLITE IA;SIGNED;Advanced MMICs for SOTM and satellites constellations;01.10.20;31.12.21;0.0;109500.0;H2020-EU.2.3.;INNOSUP-02-2019-2020;15.09.20;H2020;H2020-INNOSUP-2018-2020;H2020-INNOSUP-2020-02;CSA-LSP;;The proliferation of LEO (Low Earth Orbit) and MEO (Medium Earth Orbit) satellite constellations is changing the requirements needed by satellites and antennas in order to support the bandwidth and beam agility to accommodate the much more challenging tracking requirements uniquely associated with NGSO (non-geostationary orbit) operations. The development of beamforming techniques beyond today’s state-of-the-art is an important demand in the telecommunications industry. WIMMIC is currently developing a novel beamforming system for the ground antenna market. We now want, through SME Innovation Associate programme, to implement our expertise in this area to develop a beamformer to be implemented in telecommunication satellites. This is an important business innovation opportunity as there are no similar products in the market yet. For this, we need and IA expert in space qualified processes.;05.10.21 18:36;231593;['proliferation', 'leo', 'low', 'earth', 'orbit', 'meo', 'medium', 'earth', 'orbit', 'satellite', 'constellation', 'changing', 'requirement', 'needed', 'satellite', 'antenna', 'order', 'support', 'bandwidth', 'beam', 'agility', 'accommodate', 'much', 'challenging', 'tracking', 'requirement', 'uniquely', 'associated', 'ngso', 'nongeostationary', 'orbit', 'operation', 'development', 'beamforming', 'technique', 'beyond', 'today’s', 'stateoftheart', 'important', 'demand', 'telecommunication', 'industry', 'wimmic', 'currently', 'developing', 'novel', 'beamforming', 'system', 'ground', 'antenna', 'market', 'want', 'sme', 'innovation', 'associate', 'programme', 'implement', 'expertise', 'area', 'develop', 'beamformer', 'implemented', 'telecommunication', 'satellite', 'important', 'business', 'innovation', 'opportunity', 'similar', 'product', 'market', 'yet', 'this', 'need', 'ia', 'expert', 'space', 'qualified', 'process']
3;970958;TilePlus;SIGNED;Ground-breaking roof tile solution for solar energy collection;01.06.21;31.05.23;3472500.0;2430750.0;;EIC-FTI-2018-2020;;H2020;;H2020-EIC-FTI-2018-2020;IA;;The overall objective of the project is to mature, qualify and enable a swift market launch and scale-up of our revolutionary solar roof technology with the overarching aim to become the new reference for solar roof technology in Europe and beyond.Our disruptive E-Tile+ solution is the first solar system made of real roof tiles, having the same size, shape and appearance as normal roof tiles. These features, in contrast to standard solar panels or tiles, entail high ease of installment (40% lower installation time), reliability (i.e. 30% higher lifetime and lower maintenance costs) and safety (<120V operations vs. 400V), as well as increased exploitation of available roof area (30% more). With E-Tile+, 20-30 million roofs across the EU, which cannot be served with standard solar panels today, could be targeted to harvest solar energy. Furthermore, our unique and patented tiles contacting approach (plug-and-play and parallel connection) provides more power output (20% higher conversion efficiency) than today’s solar panels. The latter are connected in-series and thus suffer from shadow effects, high additional costs and danger (high-voltage operations that require specially qualified electricians). Hence, E-Tile+ is a solar system specifically designed for the needs of construction companies, complying with upcoming energy regulations and solving the current issues of traditional PV roof panels.This FTI project will mature E-Tile+ in terms of performance, manufacturing cost, production yield and ensure full qualification of our product for its launch in our target markets, with a Business Plan adapted to guarantee a fast and sustained market entry. TilePlus project will address the solar roof market. We will argue that E-Tile+ can be installed on 13,700 roofs, while providing 142GWh in year 5 post-project, generating accumulated revenues of €267m and net profits of €156m, create 65 new FTEs among the consortium and unlocking CO2 emission cuts of 64.4kt.;21.05.21 14:25;236314;['overall', 'objective', 'project', 'mature', 'qualify', 'enable', 'swift', 'market', 'launch', 'scaleup', 'revolutionary', 'solar', 'roof', 'technology', 'overarching', 'aim', 'become', 'new', 'reference', 'solar', 'roof', 'technology', 'europe', 'beyondour', 'disruptive', 'etile', 'solution', 'first', 'solar', 'system', 'made', 'real', 'roof', 'tile', 'size', 'shape', 'appearance', 'normal', 'roof', 'tile', 'feature', 'contrast', 'standard', 'solar', 'panel', 'tile', 'entail', 'high', 'ease', 'installment', '40', 'lower', 'installation', 'time', 'reliability', 'ie', '30', 'higher', 'lifetime', 'lower', 'maintenance', 'cost', 'safety', '120v', 'operation', 'v', '400v', 'well', 'increased', 'exploitation', 'available', 'roof', 'area', '30', 'more', 'etile', '2030', 'million', 'roof', 'across', 'eu', 'cannot', 'served', 'standard', 'solar', 'panel', 'today', 'could', 'targeted', 'harvest', 'solar', 'energy', 'furthermore', 'unique', 'patented', 'tile', 'contacting', 'approach', 'plugandplay', 'parallel', 'connection', 'provides', 'power', 'output', '20', 'higher', 'conversion', 'efficiency', 'today’s', 'solar', 'panel', 'latter', 'connected', 'inseries', 'thus', 'suffer', 'shadow', 'effect', 'high', 'additional', 'cost', 'danger', 'highvoltage', 'operation', 'require', 'specially', 'qualified', 'electrician', 'hence', 'etile', 'solar', 'system', 'specifically', 'designed', 'need', 'construction', 'company', 'complying', 'upcoming', 'energy', 'regulation', 'solving', 'current', 'issue', 'traditional', 'pv', 'roof', 'panelsthis', 'fti', 'project', 'mature', 'etile', 'term', 'performance', 'manufacturing', 'cost', 'production', 'yield', 'ensure', 'full', 'qualification', 'product', 'launch', 'target', 'market', 'business', 'plan', 'adapted', 'guarantee', 'fast', 'sustained', 'market', 'entry', 'tileplus', 'project', 'address', 'solar', 'roof', 'market', 'argue', 'etile', 'installed', '13700', 'roof', 'providing', '142gwh', 'year', '5', 'postproject', 'generating', 'accumulated', 'revenue', '€267m', 'net', 'profit', '€156m', 'create', '65', 'new', 'ftes', 'among', 'consortium', 'unlocking', 'co2', 'emission', 'cut', '644kt']
4;970564;IMPOWER2X;SIGNED;INERATEC Modular Plants for Renewable Chemical Products;01.05.21;30.04.23;3492082.5;2444457.75;;EIC-SMEInst-2018-2020;;H2020;;H2020-EIC-SMEInst-2018-2020-3;SME-2b;;INERATEC (IC) sells modular chemical plants for the production of CO2-neutral fuels and materials based on greenhouse gases and renewable power. IC`s disruptive innovation is a micro-structured reactor technology, which can be integrated into containers, allowing a numbering-up that makes the exploration of local and world-scale renewable feedstock sources economically feasible. The Fischer-Tropsch reactor is simultaneously producing e-Diesel and e-kerosene – two renewable products, which, after separation and final conditioning, can help customers in road transport and aviation to significantly reduce their CO2 footprint.  IC has implemented 10 demonstration plants so far, reaching TRL 7. With IMPOWER2X TRL 9 is reachable.To become even more successful, IC must transform its technology from demonstration applications to industrial application, consequently reducing the costs to provide the technology. To achieve that, existing plant concepts will be modularized and standardized, a serial production of the modules as well as the reactors built up and plants implemented at industrial scale and at customers’ sites. Additionally, the public and political acceptance for renewable fuels must be sharpened.IC will be able to either sell its plants or to provide long-term off-take agreements to customers in the field of e Diesel and e-kerosene, finally allowing to reduce the CO2 footprint of the individual customers by nearly 100%. Geographical sweet spots as well as promising customers worldwide will mainly be targeted.IMPOWER2X is in alignment with IC’s strategy of strengthening its position as market leader for synthetic, renewable fuel. With IC’s solution, customers and countries will be able to reach their climate targets and positively contribute to the environmental targets. This way the proposal serves the goals of the Green Deal by supporting the EU´s climate mitigation ambitions by helping to come to a clean and sustainable mobility and industry.;21.05.21 14:24;236312;['ineratec', 'ic', 'sell', 'modular', 'chemical', 'plant', 'production', 'co2neutral', 'fuel', 'material', 'based', 'greenhouse', 'gas', 'renewable', 'power', 'ic', 'disruptive', 'innovation', 'microstructured', 'reactor', 'technology', 'integrated', 'container', 'allowing', 'numberingup', 'make', 'exploration', 'local', 'worldscale', 'renewable', 'feedstock', 'source', 'economically', 'feasible', 'fischertropsch', 'reactor', 'simultaneously', 'producing', 'ediesel', 'ekerosene', '–', 'two', 'renewable', 'product', 'which', 'separation', 'final', 'conditioning', 'help', 'customer', 'road', 'transport', 'aviation', 'significantly', 'reduce', 'co2', 'footprint', 'ic', 'implemented', '10', 'demonstration', 'plant', 'far', 'reaching', 'trl', '7', 'impower2x', 'trl', '9', 'reachableto', 'become', 'even', 'successful', 'ic', 'must', 'transform', 'technology', 'demonstration', 'application', 'industrial', 'application', 'consequently', 'reducing', 'cost', 'provide', 'technology', 'achieve', 'that', 'existing', 'plant', 'concept', 'modularized', 'standardized', 'serial', 'production', 'module', 'well', 'reactor', 'built', 'plant', 'implemented', 'industrial', 'scale', 'customers’', 'site', 'additionally', 'public', 'political', 'acceptance', 'renewable', 'fuel', 'must', 'sharpenedic', 'able', 'either', 'sell', 'plant', 'provide', 'longterm', 'offtake', 'agreement', 'customer', 'field', 'e', 'diesel', 'ekerosene', 'finally', 'allowing', 'reduce', 'co2', 'footprint', 'individual', 'customer', 'nearly', '100', 'geographical', 'sweet', 'spot', 'well', 'promising', 'customer', 'worldwide', 'mainly', 'targetedimpower2x', 'alignment', 'ic’s', 'strategy', 'strengthening', 'position', 'market', 'leader', 'synthetic', 'renewable', 'fuel', 'ic’s', 'solution', 'customer', 'country', 'able', 'reach', 'climate', 'target', 'positively', 'contribute', 'environmental', 'target', 'way', 'proposal', 'serf', 'goal', 'green', 'deal', 'supporting', 'eu´s', 'climate', 'mitigation', 'ambition', 'helping', 'come', 'clean', 'sustainable', 'mobility', 'industry']
5;101026478;MCExtrusion;SIGNED;Mechanisms of Cell Extrusion controlling Tissue Homeostasis in the Intestine;01.06.21;31.05.23;187572.48;187572.48;;MSCA-IF-2020;;H2020;;H2020-MSCA-IF-2020;MSCA-IF-EF-ST;;The intestinal epithelium undergoes continuous self-renewal through coordination of cell proliferation in the crypt and cell removal in the villus region. The aim of this project is to elucidate the mechanisms controlling the removal of differentiated cells from the villus. Preliminary data indicate that most extruding cells are non-apoptotic suggesting alternative mechanisms regulating this key homeostatic event. Cells might either commit to extrusion through specific differentiation programs or local tissue mechanical constraints might force the extrusion of otherwise indistinguishable cells. Feedback between cell fate and mechanical constraints can be also envisaged. Here I propose to identify genes that control cell extrusion by analyzing the dynamic transcriptomic signature of the mouse intestinal epithelium using nascent mRNA sequencing (scEU-seq) and pharmacologic inhibition of candidate pathways in intestinal organoids. Target genes will be functionally validated by a CRISPR-Cas9-mediated knockout screen. This analysis will be flanked by experiments investigating a potential role of tissue-scale mechanical forces in cell extrusion. I will measure the mechanical properties of the intestinal epithelium and obtain a detailed description of the morphological dynamics characterizing cell extrusion using live imaging and 3D-shape reconstruction. Precise manipulation of cortical tension by means of laser ablation combined with subcellular optogenetics will be used to functionally perturb tissue mechanics and reveal the impact of cell contractility and tissue tension on the extrusion process. Collectively, this project will help understanding how tissue homeostasis in the intestinal epithelium is maintained and dissect the relative contribution of genetic signaling circuits and tissue mechanics in regulating cell extrusion.;03.05.21 21:40;235643;['intestinal', 'epithelium', 'undergoes', 'continuous', 'selfrenewal', 'coordination', 'cell', 'proliferation', 'crypt', 'cell', 'removal', 'villus', 'region', 'aim', 'project', 'elucidate', 'mechanism', 'controlling', 'removal', 'differentiated', 'cell', 'villus', 'preliminary', 'data', 'indicate', 'extruding', 'cell', 'nonapoptotic', 'suggesting', 'alternative', 'mechanism', 'regulating', 'key', 'homeostatic', 'event', 'cell', 'might', 'either', 'commit', 'extrusion', 'specific', 'differentiation', 'program', 'local', 'tissue', 'mechanical', 'constraint', 'might', 'force', 'extrusion', 'otherwise', 'indistinguishable', 'cell', 'feedback', 'cell', 'fate', 'mechanical', 'constraint', 'also', 'envisaged', 'propose', 'identify', 'gene', 'control', 'cell', 'extrusion', 'analyzing', 'dynamic', 'transcriptomic', 'signature', 'mouse', 'intestinal', 'epithelium', 'using', 'nascent', 'mrna', 'sequencing', 'sceuseq', 'pharmacologic', 'inhibition', 'candidate', 'pathway', 'intestinal', 'organoids', 'target', 'gene', 'functionally', 'validated', 'crisprcas9mediated', 'knockout', 'screen', 'analysis', 'flanked', 'experiment', 'investigating', 'potential', 'role', 'tissuescale', 'mechanical', 'force', 'cell', 'extrusion', 'measure', 'mechanical', 'property', 'intestinal', 'epithelium', 'obtain', 'detailed', 'description', 'morphological', 'dynamic', 'characterizing', 'cell', 'extrusion', 'using', 'live', 'imaging', '3dshape', 'reconstruction', 'precise', 'manipulation', 'cortical', 'tension', 'mean', 'laser', 'ablation', 'combined', 'subcellular', 'optogenetics', 'used', 'functionally', 'perturb', 'tissue', 'mechanic', 'reveal', 'impact', 'cell', 'contractility', 'tissue', 'tension', 'extrusion', 'process', 'collectively', 'project', 'help', 'understanding', 'tissue', 'homeostasis', 'intestinal', 'epithelium', 'maintained', 'dissect', 'relative', 'contribution', 'genetic', 'signaling', 'circuit', 'tissue', 'mechanic', 'regulating', 'cell', 'extrusion']
6;101000160;chemGLIO;SIGNED;Chemical synthesis of a new drug family to treat glioblastoma multiforme (GBM), the highest global unmet need in oncology;01.11.20;31.10.21;0.0;119035.0;;INNOSUP-02-2019-2020;;H2020;;H2020-INNOSUP-2020-02;CSA-LSP;;"Survival rates are increasing for most cancers but remain dismal for brain tumours in adults and children. Gliomas constitute 60% of all brain tumours and 50% of these are considered aggressive malignant tumours. Among aggressive gliomas, glioblastoma multiforme (GBM) is the deadliest and remains largely incurable. Our goal is to develop the first GBM drug for both adults and children, to improve its «universally miserable outcomes». We have discovered a novel family of compounds that are cytotoxic to cancer cells, especially to GBM. In our preclinical studies, our lead drug from these proprietary compounds (GLIX1) showed total elimination of GBM tumour mass in 50% of mice, and tumour regression in all mice.We now need to further develop GLIX1 in order to reach human clinical trials, and ultimately approval for clinical use. The critical aspects of this development includes: the establishment and optimization of a chemical synthesis method for GLIX1; synthesis of small batches and subsequent large-scale production for pre-clinical and clinical studies; and chemistry, manufacturing, and controls (CMC) related regulatory affairs.Hemispherian does not have these skills in-house, albeit they are extremely critical for the success of any drug. In that regard, the SME Innovation Associate Programme fits perfectly into our plan of boosting R&D activities within chemical synthesis. Through the recruitment of an Innovation Associate and implementation of the chemGLIO project, we will develop our novel chemical synthesis method and utilise it in the development of our ground-breaking treatment for GBM.";05.03.21 15:26;231487;['survival', 'rate', 'increasing', 'cancer', 'remain', 'dismal', 'brain', 'tumour', 'adult', 'child', 'glioma', 'constitute', '60', 'brain', 'tumour', '50', 'considered', 'aggressive', 'malignant', 'tumour', 'among', 'aggressive', 'glioma', 'glioblastoma', 'multiforme', 'gbm', 'deadliest', 'remains', 'largely', 'incurable', 'goal', 'develop', 'first', 'gbm', 'drug', 'adult', 'child', 'improve', '«universally', 'miserable', 'outcomes»', 'discovered', 'novel', 'family', 'compound', 'cytotoxic', 'cancer', 'cell', 'especially', 'gbm', 'preclinical', 'study', 'lead', 'drug', 'proprietary', 'compound', 'glix1', 'showed', 'total', 'elimination', 'gbm', 'tumour', 'mass', '50', 'mouse', 'tumour', 'regression', 'micewe', 'need', 'develop', 'glix1', 'order', 'reach', 'human', 'clinical', 'trial', 'ultimately', 'approval', 'clinical', 'use', 'critical', 'aspect', 'development', 'includes', 'establishment', 'optimization', 'chemical', 'synthesis', 'method', 'glix1', 'synthesis', 'small', 'batch', 'subsequent', 'largescale', 'production', 'preclinical', 'clinical', 'study', 'chemistry', 'manufacturing', 'control', 'cmc', 'related', 'regulatory', 'affairshemispherian', 'skill', 'inhouse', 'albeit', 'extremely', 'critical', 'success', 'drug', 'regard', 'sme', 'innovation', 'associate', 'programme', 'fit', 'perfectly', 'plan', 'boosting', 'rd', 'activity', 'within', 'chemical', 'synthesis', 'recruitment', 'innovation', 'associate', 'implementation', 'chemglio', 'project', 'develop', 'novel', 'chemical', 'synthesis', 'method', 'utilise', 'development', 'groundbreaking', 'treatment', 'gbm']
