;id;acronym;status;title;startDate;endDate;totalCost;ecMaxContribution;legalBasis;topics;ecSignatureDate;frameworkProgramme;masterCall;subCall;fundingScheme;nature;objective;contentUpdateDate;rcn;preprocessed
63;872843;GRAPHEXT;SIGNED;THE REVOLUTIONARY SYSTEM BRINGS ACTIONABLE DATA-SCIENCE INSIGHT TO THE MASSES GRAPHEXT bridges the gap between Data Science and Business Intelligence, democratising Advanced Analytics.;01.11.19;31.01.22;2490750.0;1743525.0;H2020-EU.2.3.;EIC-SMEInst-2018-2020;17.10.19;H2020;H2020-EIC-SMEInst-2018-2020;H2020-SMEInst-2018-2020-2;SME-2;;The landscape for data analytics is undergoing profound changes, 1) because of the growing awareness of organisations in the intrinsic value of the data, 2) because of the huge explosion in amount and sources of data accessible, and 3) because of developments in tools and methods to extract value from the data.The challenge for organisations is to optimally extract intrinsic value (economic, social and environmental) to remain effective and competitive. Organisations that can achieve this rapidly and most economically will certainly excel. Currently, the tools available on the market have are scattered and diverse, on one hand being conventional BI that have failed to keep up (with traditional databases and visualisation schema designed for structured data), and on the other there are sophisticated tools designed for use by data scientists, creating a major gap in between, to reach business analysts and decision makers.To date there are no tools on the market that combine these advanced data science methods together with user-friendly value-creation results and front-ends, aimed at tactical and strategic decision making.Graphext disrupts the existing market for data-science and BI analytics, by combining the full-stack functionalities in one seamless cloud-based SaaS solution. Graphext’s revolutionary approach in the analysis and visualization of complex datasets, brings the field of advanced Data Science to the mainstream.Graphext delivers an advanced system for data analytics and value-creation - providing direct ‘actionable insight` for decision makers. Graphext applies advanced scientific techniques with unsupervised automated learning together with advanced data visualisation. This is an entirely different approach to data analysis as it takes a network and statistical approach, e.g. through employing techniques such as heuristics, looking at inherent patterns, anomalies and extracting intrinsic meaning from the data - doing the work of the data scientist.;28.09.21 22:16;229340;['landscape', 'data', 'analytics', 'undergoing', 'profound', 'change', '1', 'growing', 'awareness', 'organisation', 'intrinsic', 'value', 'data', '2', 'huge', 'explosion', 'amount', 'source', 'data', 'accessible', '3', 'development', 'tool', 'method', 'extract', 'value', 'datathe', 'challenge', 'organisation', 'optimally', 'extract', 'intrinsic', 'value', 'economic', 'social', 'environmental', 'remain', 'effective', 'competitive', 'organisation', 'achieve', 'rapidly', 'economically', 'certainly', 'excel', 'currently', 'tool', 'available', 'market', 'scattered', 'diverse', 'one', 'hand', 'conventional', 'bi', 'failed', 'keep', 'with', 'traditional', 'database', 'visualisation', 'schema', 'designed', 'structured', 'data', 'sophisticated', 'tool', 'designed', 'use', 'data', 'scientist', 'creating', 'major', 'gap', 'between', 'reach', 'business', 'analyst', 'decision', 'makersto', 'date', 'tool', 'market', 'combine', 'advanced', 'data', 'science', 'method', 'together', 'userfriendly', 'valuecreation', 'result', 'frontends', 'aimed', 'tactical', 'strategic', 'decision', 'makinggraphext', 'disrupts', 'existing', 'market', 'datascience', 'bi', 'analytics', 'combining', 'fullstack', 'functionality', 'one', 'seamless', 'cloudbased', 'saas', 'solution', 'graphext’s', 'revolutionary', 'approach', 'analysis', 'visualization', 'complex', 'datasets', 'brings', 'field', 'advanced', 'data', 'science', 'mainstreamgraphext', 'delivers', 'advanced', 'system', 'data', 'analytics', 'valuecreation', 'providing', 'direct', '‘actionable', 'insight', 'decision', 'maker', 'graphext', 'applies', 'advanced', 'scientific', 'technique', 'unsupervised', 'automated', 'learning', 'together', 'advanced', 'data', 'visualisation', 'entirely', 'different', 'approach', 'data', 'analysis', 'take', 'network', 'statistical', 'approach', 'eg', 'employing', 'technique', 'heuristic', 'looking', 'inherent', 'pattern', 'anomaly', 'extracting', 'intrinsic', 'meaning', 'data', 'work', 'data', 'scientist']
64;953971;FRENETIC;SIGNED;Business scale up of an AI tool for the optimal design of power converters;01.06.20;31.05.22;1516250.0;1061375.0;;EIC-SMEInst-2018-2020;;H2020;;H2020-EIC-SMEInst-2018-2020-3;SME-2b;;Industrial manufacturers of electronic devices face the problem of redesigning the power electronics for each new product that is going to be launched to the market. In this process, the bottleneck is the design of the magnetic components that are present in the power converters. The design of the magnetics takes around 6 months on average and the resulting designs are almost never satisfactory. Surprisingly, the same design methods have been used for the last decades. These methods generate delays and excessive costs during the manufacturing process and hold back the advancements in power electronics. SP Control is a company specialized in providing solutions for industrial companies to improve their processes. Our software FRENETIC, based on our proprietary AI technology, has attained great interest in the power converters market due to its capacity to achieve optimal designs for magnetics in just a few hours versus the current 6 months, meaning a design time reduction of nearly 100%. As a result, it allows to reduce the manufacturing costs and size by half. A minimum viable version of FRENETIC is being commercialised in a software design service model entering the power electronics market and bringing great benefits to our clients. Our objective is to disrupt the power electronics market with the first solution that will allow the industrial companies to obtain optimal designs for their magnetics in a matter of hours, reducing their manufacturing costs and their time-to-market. In order to take the fully evolved version of FRENETIC to the market, we need to scaleup our business model and demonstrate its value in a fully operative environment. In a market which value in 2023 has been estimated in €46 billion, the successful market uptake of our innovation represents a breakthrough in industrial design and a great business opportunity as large as €5 billion.;09.04.21 15:20;229863;['industrial', 'manufacturer', 'electronic', 'device', 'face', 'problem', 'redesigning', 'power', 'electronics', 'new', 'product', 'going', 'launched', 'market', 'process', 'bottleneck', 'design', 'magnetic', 'component', 'present', 'power', 'converter', 'design', 'magnetics', 'take', 'around', '6', 'month', 'average', 'resulting', 'design', 'almost', 'never', 'satisfactory', 'surprisingly', 'design', 'method', 'used', 'last', 'decade', 'method', 'generate', 'delay', 'excessive', 'cost', 'manufacturing', 'process', 'hold', 'back', 'advancement', 'power', 'electronics', 'sp', 'control', 'company', 'specialized', 'providing', 'solution', 'industrial', 'company', 'improve', 'process', 'software', 'frenetic', 'based', 'proprietary', 'ai', 'technology', 'attained', 'great', 'interest', 'power', 'converter', 'market', 'due', 'capacity', 'achieve', 'optimal', 'design', 'magnetics', 'hour', 'versus', 'current', '6', 'month', 'meaning', 'design', 'time', 'reduction', 'nearly', '100', 'result', 'allows', 'reduce', 'manufacturing', 'cost', 'size', 'half', 'minimum', 'viable', 'version', 'frenetic', 'commercialised', 'software', 'design', 'service', 'model', 'entering', 'power', 'electronics', 'market', 'bringing', 'great', 'benefit', 'client', 'objective', 'disrupt', 'power', 'electronics', 'market', 'first', 'solution', 'allow', 'industrial', 'company', 'obtain', 'optimal', 'design', 'magnetics', 'matter', 'hour', 'reducing', 'manufacturing', 'cost', 'timetomarket', 'order', 'take', 'fully', 'evolved', 'version', 'frenetic', 'market', 'need', 'scaleup', 'business', 'model', 'demonstrate', 'value', 'fully', 'operative', 'environment', 'market', 'value', '2023', 'estimated', '€46', 'billion', 'successful', 'market', 'uptake', 'innovation', 'represents', 'breakthrough', 'industrial', 'design', 'great', 'business', 'opportunity', 'large', '€5', 'billion']
65;945936;MBSelect;SIGNED;A novel technology enabling efficient delivery of personalized probiotics  to prevent gut-related diseases and recover damaged gut microbiota;01.06.20;31.05.22;2851000.0;1995700.0;;EIC-SMEInst-2018-2020;;H2020;;H2020-EIC-SMEInst-2018-2020-3;SME-2b;;"Gut-microbiome is an essential part of human health. Gut bacteria imbalance is now recognized as a crucial factor in the development of many diseases – chronic, obesity, diabetes, liver, cardio, cancer and neurodegenerative.  Traditional probiotics used today, aimed at restoring this imbalance, are not effective: They are incapable of delivering sufficient number and variety of bacteria to the correct location in the gut and have them colonize. MyBiotics, a microbiome company, developed a novel technology for very efficient growth, delivery, and colonization of needed bacteria types in the gut. The technology uses innovative fermentation methods to grow complex bacteria communities on micro-particles, dry it to powder and place into capsules administered like any probiotic supplement. MyBiotics proved the technology for single-strain-bacteria and for replicating multi-strain biological samples. In this project it is introducing MBSelect, which will remove the reliance on a biological sample and add formulation of multi-strain communities of human bacteria, grown in pre-selected clusters in any combination. The MBSelect innovation enables, for the first time, the creation of personalized, microbiome-based probiotics, fitted to any purpose – recovery from illness, chronic condition, or as supplements – and fitted to specific microbiome needs of different ethnicities, age, and gender. MyBiotics won and executed a Phase1 feasibility study in 2015, which served as a basis for its development since and for this project application. MyBiotics’ objectives in this project are to complete the development of the MBSelect technology, develop its first three probiotic products, scale them to industrial level, test them, and produce the 1st batch for initial commercial market testing immediately following the project; followed by full EU & US commercialization and scaling.  The success of MBSelect is key in realizing the potential of MyBiotics and enabling the company to grow.";14.04.21 23:06;229624;['gutmicrobiome', 'essential', 'part', 'human', 'health', 'gut', 'bacteria', 'imbalance', 'recognized', 'crucial', 'factor', 'development', 'many', 'disease', '–', 'chronic', 'obesity', 'diabetes', 'liver', 'cardio', 'cancer', 'neurodegenerative', 'traditional', 'probiotic', 'used', 'today', 'aimed', 'restoring', 'imbalance', 'effective', 'incapable', 'delivering', 'sufficient', 'number', 'variety', 'bacteria', 'correct', 'location', 'gut', 'colonize', 'mybiotics', 'microbiome', 'company', 'developed', 'novel', 'technology', 'efficient', 'growth', 'delivery', 'colonization', 'needed', 'bacteria', 'type', 'gut', 'technology', 'us', 'innovative', 'fermentation', 'method', 'grow', 'complex', 'bacteria', 'community', 'microparticles', 'dry', 'powder', 'place', 'capsule', 'administered', 'like', 'probiotic', 'supplement', 'mybiotics', 'proved', 'technology', 'singlestrainbacteria', 'replicating', 'multistrain', 'biological', 'sample', 'project', 'introducing', 'mbselect', 'remove', 'reliance', 'biological', 'sample', 'add', 'formulation', 'multistrain', 'community', 'human', 'bacteria', 'grown', 'preselected', 'cluster', 'combination', 'mbselect', 'innovation', 'enables', 'first', 'time', 'creation', 'personalized', 'microbiomebased', 'probiotic', 'fitted', 'purpose', '–', 'recovery', 'illness', 'chronic', 'condition', 'supplement', '–', 'fitted', 'specific', 'microbiome', 'need', 'different', 'ethnicity', 'age', 'gender', 'mybiotics', 'executed', 'phase1', 'feasibility', 'study', '2015', 'served', 'basis', 'development', 'since', 'project', 'application', 'mybiotics’', 'objective', 'project', 'complete', 'development', 'mbselect', 'technology', 'develop', 'first', 'three', 'probiotic', 'product', 'scale', 'industrial', 'level', 'test', 'them', 'produce', '1st', 'batch', 'initial', 'commercial', 'market', 'testing', 'immediately', 'following', 'project', 'followed', 'full', 'eu', 'u', 'commercialization', 'scaling', 'success', 'mbselect', 'key', 'realizing', 'potential', 'mybiotics', 'enabling', 'company', 'grow']
66;962036;BRIGHT;SIGNED;Treat severe cases of infection at COV with XAV-19;01.08.20;31.07.22;3127625.0;2162650.0;;EIC-SMEInst-2018-2020;;H2020;;H2020-EIC-SMEInst-2018-2020-3;SME-2b;crisisResponse;Since 2014 XENOTHERA has developed a platform for producing Glyco-Humanized Polyclonal Antibodies (GH-pAb) with high efficiency and optimized safety. It has been known for decades that polyclonal antibodies are very efficient weapons in infectious diseases, either bacterial or viral, and they are established as superior to monoclonal in various viral infections.Since the beginning of the pandemic XENOTHERA has initiated a project to develop a new treatment against COVID-19 based on its technology. The product is named XAV-19 and is expected to treat patients suffering from moderate to severe pneumonia.The purpose of BRIGHT is to prepare the product, run all necessary investigation so that we can safely run a clinical trial demonstrating the efficacy of the product. This will be a phase 2 double-blind clinical trial of XAV19 versus placebo. The endpoint will be the quick recovery of patients admitted at the hospital.;14.04.21 22:54;230593;['since', '2014', 'xenothera', 'developed', 'platform', 'producing', 'glycohumanized', 'polyclonal', 'antibody', 'ghpab', 'high', 'efficiency', 'optimized', 'safety', 'known', 'decade', 'polyclonal', 'antibody', 'efficient', 'weapon', 'infectious', 'disease', 'either', 'bacterial', 'viral', 'established', 'superior', 'monoclonal', 'various', 'viral', 'infectionssince', 'beginning', 'pandemic', 'xenothera', 'initiated', 'project', 'develop', 'new', 'treatment', 'covid19', 'based', 'technology', 'product', 'named', 'xav19', 'expected', 'treat', 'patient', 'suffering', 'moderate', 'severe', 'pneumoniathe', 'purpose', 'bright', 'prepare', 'product', 'run', 'necessary', 'investigation', 'safely', 'run', 'clinical', 'trial', 'demonstrating', 'efficacy', 'product', 'phase', '2', 'doubleblind', 'clinical', 'trial', 'xav19', 'versus', 'placebo', 'endpoint', 'quick', 'recovery', 'patient', 'admitted', 'hospital']
67;961127;EXPANSE;SIGNED;European Expansion of moveUP;01.08.20;31.07.22;2587625.0;1724137.0;;EIC-SMEInst-2018-2020;;H2020;;H2020-EIC-SMEInst-2018-2020-3;SME-2b;crisisResponse;2020 will be remembered as year zero of tele-medicine. moveUP has developed a mobile health platform that monitors, informs and treats patients via standardised & validated protocols.    Its first product is in orthopaedics, but with the Corona Crisis and the cancellation of all elective procedures, the platform has been extended to other pathologies.  On 18/03, a monitoring protocol of suspected Covid19 patients has been offered to General Practitioners (GP), enabling them to follow-up symptoms of hundreds of patients, and intervene in case of need.  The topic of this program remains orthopaedic joint replacements. But the benefits of the solution and its applicability for infectious or disabling diseases which restricts movement to the GP will be clear to the reader.  Joint replacements are referred to as the surgery of the century, as the number are growing exponentially. But 20-30% of patients remain unsatisfied and quality of care is not measured.  moveUP offers patients a safe, efficient and qualitative therapy to be made from the comfort of their home. It uses medical device certified machine learning models to adapt activity level, exercises, medication and coach patients, under uner supervision of healthcare providers.   The therapy has shown in clinical studies to offer excellent outcomes, lower variability, and objective measure of quality, at a lower cost compared to standard of care. More than 1200 patients have been treated and it is the first digital therapy fully reimbursed by the national health insurance in Belgium.   moveUP and has taken first steps to expand across Europe. But the fragmentation of the European Healthcare markets makes it more difficult for a start-up to scale and raise funding.  The purpose of this application is to enable moveUP to adapt and certify its therapy in 4 target countries, run large scale pilots to demonstrate efficacy and health economic benefit, and to conclude partnerships with strategic partners to gain scale.;14.04.21 22:47;230442;['2020', 'remembered', 'year', 'zero', 'telemedicine', 'moveup', 'developed', 'mobile', 'health', 'platform', 'monitor', 'informs', 'treat', 'patient', 'via', 'standardised', 'validated', 'protocol', 'first', 'product', 'orthopaedics', 'corona', 'crisis', 'cancellation', 'elective', 'procedure', 'platform', 'extended', 'pathology', '1803', 'monitoring', 'protocol', 'suspected', 'covid19', 'patient', 'offered', 'general', 'practitioner', 'gp', 'enabling', 'followup', 'symptom', 'hundred', 'patient', 'intervene', 'case', 'need', 'topic', 'program', 'remains', 'orthopaedic', 'joint', 'replacement', 'benefit', 'solution', 'applicability', 'infectious', 'disabling', 'disease', 'restricts', 'movement', 'gp', 'clear', 'reader', 'joint', 'replacement', 'referred', 'surgery', 'century', 'number', 'growing', 'exponentially', '2030', 'patient', 'remain', 'unsatisfied', 'quality', 'care', 'measured', 'moveup', 'offer', 'patient', 'safe', 'efficient', 'qualitative', 'therapy', 'made', 'comfort', 'home', 'us', 'medical', 'device', 'certified', 'machine', 'learning', 'model', 'adapt', 'activity', 'level', 'exercise', 'medication', 'coach', 'patient', 'uner', 'supervision', 'healthcare', 'provider', 'therapy', 'shown', 'clinical', 'study', 'offer', 'excellent', 'outcome', 'lower', 'variability', 'objective', 'measure', 'quality', 'lower', 'cost', 'compared', 'standard', 'care', '1200', 'patient', 'treated', 'first', 'digital', 'therapy', 'fully', 'reimbursed', 'national', 'health', 'insurance', 'belgium', 'moveup', 'taken', 'first', 'step', 'expand', 'across', 'europe', 'fragmentation', 'european', 'healthcare', 'market', 'make', 'difficult', 'startup', 'scale', 'raise', 'funding', 'purpose', 'application', 'enable', 'moveup', 'adapt', 'certify', 'therapy', '4', 'target', 'country', 'run', 'large', 'scale', 'pilot', 'demonstrate', 'efficacy', 'health', 'economic', 'benefit', 'conclude', 'partnership', 'strategic', 'partner', 'gain', 'scale']
68;951011;SolarDOOH;SIGNED;Off-grid digital out-of-home public information LCD screen technology with solar-assisted backlight;01.05.20;31.10.22;3055330.0;2244106.0;;EIC-FTI-2018-2020;;H2020;;H2020-EIC-FTI-2018-2020;IA;;Although the global outdoor digital signage totems market (dominated by LCD technology which offers better resolution in close proximity) is growing, there are restraints posing a threat to its continued growth:Technological limitations: Current outdoor totems cannot operate in direct sunlight due to the risk of liquid crystals of LCD melting resulting in black botches on the screen (solar clearing), thus limiting areas where totems can be installed. Also, sunlight causes LCD screens to consume a lot of power as they have to compete with the sun’s rays for the image to be visible to the human eye.High grid connection and installation costs, which can be as high as 2x the totem cost thus increasing total cost of ownershipTo address this, the SolarDOOH – Imecon (IT), S’Tile (FR), LGOptics (LV) and Agenzia del Trasporto Pubblico Locale del bacino della Città Metropolitana di Milano, Monza e Brianza, Lodi e Pavia (IT) – will commericalize the world’s first off-grid digital signage totem that is unlimited by electricity accessibility and dramatically reduces TOC (22%), O&M costs (33%), installation costs (66%) and installation time (1 day). For power, the totem will use a photovoltaic (PV) system coupled with a battery system and will incorporate an innovative solar backlight technology that uses sunlight as a complementary, rather than competing light, enabling >50% reduction in power consumption. This technology will be integrated in smart bus shelters and provide information stream to its users. Being off-grid enables creation of mobile totems for use during mass gatherings such as concerts, marathons, demonstrations or unexpected events in cities like emergency roadblocks.Through this project, the consortium seeks to optimise the solar backlight system, integrate and test the totem at bus shelters. Through commercialisation of this solution, the consortium aims to earn 4-year cumulative turnover of ~112.94M€, profits of €28.24 million, and an ROI of 13.9.;15.04.21 04:46;229491;['although', 'global', 'outdoor', 'digital', 'signage', 'totem', 'market', 'dominated', 'lcd', 'technology', 'offer', 'better', 'resolution', 'close', 'proximity', 'growing', 'restraint', 'posing', 'threat', 'continued', 'growthtechnological', 'limitation', 'current', 'outdoor', 'totem', 'cannot', 'operate', 'direct', 'sunlight', 'due', 'risk', 'liquid', 'crystal', 'lcd', 'melting', 'resulting', 'black', 'botch', 'screen', 'solar', 'clearing', 'thus', 'limiting', 'area', 'totem', 'installed', 'also', 'sunlight', 'cause', 'lcd', 'screen', 'consume', 'lot', 'power', 'compete', 'sun’s', 'ray', 'image', 'visible', 'human', 'eyehigh', 'grid', 'connection', 'installation', 'cost', 'high', '2x', 'totem', 'cost', 'thus', 'increasing', 'total', 'cost', 'ownershipto', 'address', 'this', 'solardooh', '–', 'imecon', 'it', 's’tile', 'fr', 'lgoptics', 'lv', 'agenzia', 'del', 'trasporto', 'pubblico', 'locale', 'del', 'bacino', 'della', 'città', 'metropolitana', 'di', 'milano', 'monza', 'e', 'brianza', 'lodi', 'e', 'pavia', 'it', '–', 'commericalize', 'world’s', 'first', 'offgrid', 'digital', 'signage', 'totem', 'unlimited', 'electricity', 'accessibility', 'dramatically', 'reduces', 'toc', '22', 'om', 'cost', '33', 'installation', 'cost', '66', 'installation', 'time', '1', 'day', 'power', 'totem', 'use', 'photovoltaic', 'pv', 'system', 'coupled', 'battery', 'system', 'incorporate', 'innovative', 'solar', 'backlight', 'technology', 'us', 'sunlight', 'complementary', 'rather', 'competing', 'light', 'enabling', '50', 'reduction', 'power', 'consumption', 'technology', 'integrated', 'smart', 'bus', 'shelter', 'provide', 'information', 'stream', 'user', 'offgrid', 'enables', 'creation', 'mobile', 'totem', 'use', 'mass', 'gathering', 'concert', 'marathon', 'demonstration', 'unexpected', 'event', 'city', 'like', 'emergency', 'roadblocksthrough', 'project', 'consortium', 'seek', 'optimise', 'solar', 'backlight', 'system', 'integrate', 'test', 'totem', 'bus', 'shelter', 'commercialisation', 'solution', 'consortium', 'aim', 'earn', '4year', 'cumulative', 'turnover', '11294m€', 'profit', '€2824', 'million', 'roi', '139']
